id,name,year_horizon,addressable_value_usd_b,capture_rate_pct,implied_revenue_usd_b,multiple,implied_ev_usd_b,probability,tier,notes
floor,SaaS-of-record (current math floor),5,150,2.5,0.06,15,0.33,0.40,projection,"Current 5-year projections at sim-comp multiples. Lupine becomes a respectable Synopsys-tier vertical software company. This is the math floor on the homepage."
mid-platform,Audit substrate (mid-platform),10,2000,0.20,4.0,17,68,0.30,projection,"By FY35: $2T addressable from mid-ramp of phases 2-3; Lupine captures the median platform-infra rate (0.20%) at mid-platform multiples (17x). Comparable to Cloudflare or Hugging Face mature."
upper-platform,Category leader (audit + compute substrate),15,3500,0.50,17.5,18,315,0.20,projection,"By FY40: phase-3 fully landed; Lupine is to atomistic ML what Synopsys is to EDA. ~0.5% capture rate at 18x multiple. Comparable to Synopsys today on a phase-mature market."
civilizational,Civilizational infrastructure,20,4500,1.00,45.0,20,900,0.07,projection,"By FY45: phase-4 partially landed; Lupine is the canonical audit+compute layer for programmable matter at narrow material classes. ~1% capture rate at 20x multiple. Comparable to AWS/Microsoft Azure infra revenue scale."
asymmetric-tail,Replicator default infra,25,5000,2.00,100.0,15,1500,0.03,directional,"By FY50: phase-4 fully landed across drugs/alloys/semis/polymers/food; Lupine occupies the position TCP/IP holds for networks — the methodology layer that all matter design runs through. ~2% capture, 15x mature multiple."
zero,Failure / wind-down,5,0,0,0,0,0,0.00,projection,"Mathematically excluded here because the math floor section already accounts for the 50% Pr(zero) outcome. The ceiling table prices the conditional-on-execution scenarios."
